--
-- Test large object support
--
-- ensure consistent test output regardless of the default bytea format
SET bytea_output TO escape;
-- Load a file
CREATE TABLE lotest_stash_values (loid oid, junk integer, fd integer);
-- lo_creat(mode integer) returns oid
-- The mode arg to lo_creat is unused, some vestigal holdover from ancient times
-- returns the large object id
INSERT INTO lotest_stash_values (loid) VALUES( lo_creat(42) );
ERROR:  Postgres-XC does not support large object yet
DETAIL:  The feature is not currently supported
-- Test ALTER LARGE OBJECT
CREATE ROLE regresslo;
DO $$
  BEGIN
    EXECUTE 'ALTER LARGE OBJECT ' || (select loid from lotest_stash_values)
		|| ' OWNER TO regresslo';
  END
$$;
ERROR:  query string argument of EXECUTE is null
CONTEXT:  PL/pgSQL function inline_code_block line 3 at EXECUTE statement
SELECT
	rol.rolname
FROM
	lotest_stash_values s
	JOIN pg_largeobject_metadata lo ON s.loid = lo.oid
	JOIN pg_authid rol ON lo.lomowner = rol.oid;
 rolname 
---------
(0 rows)

-- NOTE: large objects require transactions
BEGIN;
-- lo_open(lobjId oid, mode integer) returns integer
-- The mode parameter to lo_open uses two constants:
--   INV_READ  = 0x20000
--   INV_WRITE = 0x40000
-- The return value is a file descriptor-like value which remains valid for the
-- transaction.
UPDATE lotest_stash_values SET fd = lo_open(loid, CAST(x'20000' | x'40000' AS integer));
-- loread/lowrite names are wonky, different from other functions which are lo_*
-- lowrite(fd integer, data bytea) returns integer
-- the integer is the number of bytes written
SELECT lowrite(fd, '
Whose woods these are I think I know,
His house is in the village though.
He will not see me stopping here,
To watch his woods fill up with snow.

My little horse must think it queer,
To stop without a farmhouse near,
Between the woods and frozen lake,
The darkest evening of the year.

He gives his harness bells a shake,
To ask if there is some mistake.
The only other sound''s the sweep,
Of easy wind and downy flake.

The woods are lovely, dark and deep,
But I have promises to keep,
And miles to go before I sleep,
And miles to go before I sleep.

         -- Robert Frost
') FROM lotest_stash_values;
 lowrite 
---------
(0 rows)

-- lo_close(fd integer) returns integer
-- return value is 0 for success, or <0 for error (actually only -1, but...)
SELECT lo_close(fd) FROM lotest_stash_values;
 lo_close 
----------
(0 rows)

END;
-- Read out a portion
BEGIN;
UPDATE lotest_stash_values SET fd=lo_open(loid, CAST(x'20000' | x'40000' AS integer));
-- lo_lseek(fd integer, offset integer, whence integer) returns integer
-- offset is in bytes, whence is one of three values:
--  SEEK_SET (= 0) meaning relative to beginning
--  SEEK_CUR (= 1) meaning relative to current position
--  SEEK_END (= 2) meaning relative to end (offset better be negative)
-- returns current position in file
SELECT lo_lseek(fd, 422, 0) FROM lotest_stash_values;
 lo_lseek 
----------
(0 rows)

-- loread/lowrite names are wonky, different from other functions which are lo_*
-- loread(fd integer, len integer) returns bytea
SELECT loread(fd, 35) FROM lotest_stash_values;
 loread 
--------
(0 rows)

SELECT lo_lseek(fd, -19, 1) FROM lotest_stash_values;
 lo_lseek 
----------
(0 rows)

SELECT lowrite(fd, 'n') FROM lotest_stash_values;
 lowrite 
---------
(0 rows)

SELECT lo_tell(fd) FROM lotest_stash_values;
 lo_tell 
---------
(0 rows)

SELECT lo_lseek(fd, -156, 2) FROM lotest_stash_values;
 lo_lseek 
----------
(0 rows)

SELECT loread(fd, 35) FROM lotest_stash_values;
 loread 
--------
(0 rows)

SELECT lo_close(fd) FROM lotest_stash_values;
 lo_close 
----------
(0 rows)

END;
-- Test resource management
BEGIN;
SELECT lo_open(loid, x'40000'::int) from lotest_stash_values;
 lo_open 
---------
(0 rows)

ABORT;
-- Test truncation.
BEGIN;
UPDATE lotest_stash_values SET fd=lo_open(loid, CAST(x'20000' | x'40000' AS integer));
SELECT lo_truncate(fd, 10) FROM lotest_stash_values;
 lo_truncate 
-------------
(0 rows)

SELECT loread(fd, 15) FROM lotest_stash_values;
 loread 
--------
(0 rows)

SELECT lo_truncate(fd, 10000) FROM lotest_stash_values;
 lo_truncate 
-------------
(0 rows)

SELECT loread(fd, 10) FROM lotest_stash_values;
 loread 
--------
(0 rows)

SELECT lo_lseek(fd, 0, 2) FROM lotest_stash_values;
 lo_lseek 
----------
(0 rows)

SELECT lo_tell(fd) FROM lotest_stash_values;
 lo_tell 
---------
(0 rows)

SELECT lo_truncate(fd, 5000) FROM lotest_stash_values;
 lo_truncate 
-------------
(0 rows)

SELECT lo_lseek(fd, 0, 2) FROM lotest_stash_values;
 lo_lseek 
----------
(0 rows)

SELECT lo_tell(fd) FROM lotest_stash_values;
 lo_tell 
---------
(0 rows)

SELECT lo_close(fd) FROM lotest_stash_values;
 lo_close 
----------
(0 rows)

END;
-- Test 64-bit large object functions.
BEGIN;
UPDATE lotest_stash_values SET fd = lo_open(loid, CAST(x'20000' | x'40000' AS integer));
SELECT lo_lseek64(fd, 4294967296, 0) FROM lotest_stash_values;
 lo_lseek64 
------------
(0 rows)

SELECT lowrite(fd, 'offset:4GB') FROM lotest_stash_values;
 lowrite 
---------
(0 rows)

SELECT lo_tell64(fd) FROM lotest_stash_values;
 lo_tell64 
-----------
(0 rows)

SELECT lo_lseek64(fd, -10, 1) FROM lotest_stash_values;
 lo_lseek64 
------------
(0 rows)

SELECT lo_tell64(fd) FROM lotest_stash_values;
 lo_tell64 
-----------
(0 rows)

SELECT loread(fd, 10) FROM lotest_stash_values;
 loread 
--------
(0 rows)

SELECT lo_truncate64(fd, 5000000000) FROM lotest_stash_values;
 lo_truncate64 
---------------
(0 rows)

SELECT lo_lseek64(fd, 0, 2) FROM lotest_stash_values;
 lo_lseek64 
------------
(0 rows)

SELECT lo_tell64(fd) FROM lotest_stash_values;
 lo_tell64 
-----------
(0 rows)

SELECT lo_truncate64(fd, 3000000000) FROM lotest_stash_values;
 lo_truncate64 
---------------
(0 rows)

SELECT lo_lseek64(fd, 0, 2) FROM lotest_stash_values;
 lo_lseek64 
------------
(0 rows)

SELECT lo_tell64(fd) FROM lotest_stash_values;
 lo_tell64 
-----------
(0 rows)

SELECT lo_close(fd) FROM lotest_stash_values;
 lo_close 
----------
(0 rows)

END;
-- lo_unlink(lobjId oid) returns integer
-- return value appears to always be 1
SELECT lo_unlink(loid) from lotest_stash_values;
 lo_unlink 
-----------
(0 rows)

TRUNCATE lotest_stash_values;
INSERT INTO lotest_stash_values (loid) VALUES( lo_import('@abs_srcdir@/data/tenk.data') );
ERROR:  Postgres-XC does not support large object yet
DETAIL:  The feature is not currently supported
BEGIN;
UPDATE lotest_stash_values SET fd=lo_open(loid, CAST(x'20000' | x'40000' AS integer));
-- verify length of large object
SELECT lo_lseek(fd, 0, 2) FROM lotest_stash_values;
 lo_lseek 
----------
(0 rows)

-- with the default BLKSZ, LOBLKSZ = 2048, so this positions us for a block
-- edge case
SELECT lo_lseek(fd, 2030, 0) FROM lotest_stash_values;
 lo_lseek 
----------
(0 rows)

-- this should get half of the value from page 0 and half from page 1 of the
-- large object
SELECT loread(fd, 36) FROM lotest_stash_values;
 loread 
--------
(0 rows)

SELECT lo_tell(fd) FROM lotest_stash_values;
 lo_tell 
---------
(0 rows)

SELECT lo_lseek(fd, -26, 1) FROM lotest_stash_values;
 lo_lseek 
----------
(0 rows)

SELECT lowrite(fd, 'abcdefghijklmnop') FROM lotest_stash_values;
 lowrite 
---------
(0 rows)

SELECT lo_lseek(fd, 2030, 0) FROM lotest_stash_values;
 lo_lseek 
----------
(0 rows)

SELECT loread(fd, 36) FROM lotest_stash_values;
 loread 
--------
(0 rows)

SELECT lo_close(fd) FROM lotest_stash_values;
 lo_close 
----------
(0 rows)

END;
SELECT lo_export(loid, '@abs_srcdir@/results/lotest.txt') FROM lotest_stash_values;
 lo_export 
-----------
(0 rows)

COPY lotest_stash_values TO '@abs_srcdir@/results/lotest.txt';
\lo_import '@abs_srcdir@/results/lotest.txt'
ERROR:  Postgres-XC does not support large object yet
DETAIL:  The feature is not currently supported
\set newloid :LASTOID
-- just make sure \lo_export does not barf
\lo_export :newloid '@abs_srcdir@/results/lotest2.txt'
ERROR:  Postgres-XC does not support large object yet
DETAIL:  The feature is not currently supported
-- This is a hack to test that export/import are reversible
-- This uses knowledge about the inner workings of large object mechanism
-- which should not be used outside it.  This makes it a HACK
SELECT pageno, data FROM pg_largeobject WHERE loid = (SELECT loid from lotest_stash_values)
EXCEPT
SELECT pageno, data FROM pg_largeobject WHERE loid = :newloid;
 pageno | data 
--------+------
(0 rows)

SELECT lo_unlink(loid) FROM lotest_stash_values;
 lo_unlink 
-----------
(0 rows)

\lo_unlink :newloid
ERROR:  Postgres-XC does not support large object yet
DETAIL:  The feature is not currently supported
TRUNCATE lotest_stash_values;
DROP ROLE regresslo;
