CREATE CONTINUOUS VIEW cont_matrel AS SELECT COUNT(*) FROM cont_matrel_stream;
INSERT INTO cont_matrel_stream (x) VALUES (1);
SELECT * FROM cont_matrel;
 count 
-------
     1
(1 row)

INSERT INTO cont_matrel_mrel (count) VALUES (1);
ERROR:  cannot change materialization table "cont_matrel_mrel" of continuous view "cont_matrel"
HINT:  Toggle the "continuous_query_materialization_table_updatable" parameter to change this behavior.
UPDATE cont_matrel_mrel SET count = 2;
ERROR:  cannot change materialization table "cont_matrel_mrel" of continuous view "cont_matrel"
HINT:  Toggle the "continuous_query_materialization_table_updatable" parameter to change this behavior.
DELETE FROM cont_matrel_mrel;
ERROR:  cannot change materialization table "cont_matrel_mrel" of continuous view "cont_matrel"
HINT:  Toggle the "continuous_query_materialization_table_updatable" parameter to change this behavior.
SET continuous_query_materialization_table_updatable TO ON;
UPDATE cont_matrel_mrel SET count = 2;
SELECT * FROM cont_matrel;
 count 
-------
     2
(1 row)

INSERT INTO cont_matrel_stream (x) VALUES (1);
SELECT * FROM cont_matrel;
 count 
-------
     3
(1 row)

DELETE FROM cont_matrel_mrel;
SELECT * FROM cont_matrel;
 count 
-------
(0 rows)

INSERT INTO cont_matrel_stream (x) VALUES (1);
SELECT * FROM cont_matrel;
 count 
-------
     1
(1 row)

TRUNCATE CONTINUOUS VIEW cont_matrel;
INSERT INTO cont_matrel_mrel (count) VALUES (5);
SELECT * FROM cont_matrel;
 count 
-------
     5
(1 row)

INSERT INTO cont_matrel_stream (x) VALUES (1);
SELECT * FROM cont_matrel;
 count 
-------
     6
(1 row)

